{
  "protocol_version": "0.1.0",
  "id": "bridge_market",
  "display_name": {
    "zh-CN": "虹桥坊市",
    "en": "Rainbow Bridge Market",
    "ru": "Рынок у Радужного моста",
    "ja": "虹橋の市"
  },
  "description": {
    "zh-CN": "河两岸的市。桥上过船的时候，整条街都停下来看。",
    "en": "A market on both banks. When a boat goes under the bridge, the whole street stops to watch."
  },
  "license": {
    "code": "0BSD",
    "assets": "CC0-1.0"
  },
  "bounds": {
    "width": 640,
    "height": 480
  },
  "background": "#d2c3a0",
  "spawns": {
    "default": {
      "at": [
        310,
        140
      ]
    },
    "from_village": {
      "at": [
        500,
        160
      ]
    },
    "from_pastoral": {
      "at": [
        80,
        160
      ]
    }
  },
  "entities": [
    {
      "id": "wall_n",
      "at": [
        0,
        0
      ],
      "components": [
        {
          "type": "sprite",
          "size": [
            640,
            16
          ],
          "color": "#8a7352",
          "z": 0
        },
        {
          "type": "solid",
          "size": [
            640,
            16
          ]
        }
      ]
    },
    {
      "id": "wall_s",
      "at": [
        0,
        464
      ],
      "components": [
        {
          "type": "sprite",
          "size": [
            640,
            16
          ],
          "color": "#8a7352",
          "z": 0
        },
        {
          "type": "solid",
          "size": [
            640,
            16
          ]
        }
      ]
    },
    {
      "id": "wall_w",
      "at": [
        0,
        0
      ],
      "components": [
        {
          "type": "sprite",
          "size": [
            16,
            480
          ],
          "color": "#8a7352",
          "z": 0
        },
        {
          "type": "solid",
          "size": [
            16,
            480
          ]
        }
      ]
    },
    {
      "id": "wall_e",
      "at": [
        624,
        0
      ],
      "components": [
        {
          "type": "sprite",
          "size": [
            16,
            480
          ],
          "color": "#8a7352",
          "z": 0
        },
        {
          "type": "solid",
          "size": [
            16,
            480
          ]
        }
      ]
    },
    {
      "id": "river",
      "at": [
        16,
        200
      ],
      "components": [
        {
          "type": "sprite",
          "size": [
            608,
            60
          ],
          "color": "#8fa8ba",
          "z": -6
        }
      ]
    },
    {
      "id": "water_west",
      "at": [
        16,
        200
      ],
      "components": [
        {
          "type": "solid",
          "size": [
            236,
            60
          ]
        }
      ]
    },
    {
      "id": "water_east",
      "at": [
        388,
        200
      ],
      "components": [
        {
          "type": "solid",
          "size": [
            236,
            60
          ]
        }
      ]
    },
    {
      "id": "bridge_deck",
      "at": [
        252,
        192
      ],
      "components": [
        {
          "type": "sprite",
          "size": [
            136,
            76
          ],
          "color": "#a87f52",
          "z": -4
        }
      ]
    },
    {
      "id": "rail_west",
      "at": [
        248,
        188
      ],
      "components": [
        {
          "type": "sprite",
          "size": [
            8,
            84
          ],
          "color": "#8a6a45",
          "z": 0
        },
        {
          "type": "solid",
          "size": [
            8,
            84
          ]
        }
      ]
    },
    {
      "id": "rail_east",
      "at": [
        384,
        188
      ],
      "components": [
        {
          "type": "sprite",
          "size": [
            8,
            84
          ],
          "color": "#8a6a45",
          "z": 0
        },
        {
          "type": "solid",
          "size": [
            8,
            84
          ]
        }
      ]
    },
    {
      "id": "barge",
      "at": [
        96,
        268
      ],
      "components": [
        {
          "type": "sprite",
          "size": [
            74,
            26
          ],
          "color": "#8a6a45",
          "z": 0
        },
        {
          "type": "solid",
          "size": [
            74,
            26
          ]
        }
      ]
    },
    {
      "id": "stall_nw",
      "at": [
        80,
        80
      ],
      "components": [
        {
          "type": "sprite",
          "size": [
            90,
            60
          ],
          "color": "#b58f5c",
          "z": 0
        },
        {
          "type": "solid",
          "size": [
            90,
            60
          ]
        }
      ]
    },
    {
      "id": "stall_nc",
      "at": [
        210,
        80
      ],
      "components": [
        {
          "type": "sprite",
          "size": [
            76,
            56
          ],
          "color": "#b58f5c",
          "z": 0
        },
        {
          "type": "solid",
          "size": [
            76,
            56
          ]
        }
      ]
    },
    {
      "id": "stall_ne",
      "at": [
        420,
        70
      ],
      "components": [
        {
          "type": "sprite",
          "size": [
            110,
            64
          ],
          "color": "#b58f5c",
          "z": 0
        },
        {
          "type": "solid",
          "size": [
            110,
            64
          ]
        }
      ]
    },
    {
      "id": "awning_nw",
      "at": [
        76,
        136
      ],
      "components": [
        {
          "type": "sprite",
          "size": [
            98,
            16
          ],
          "color": "#b2452f",
          "z": -1
        }
      ]
    },
    {
      "id": "awning_ne",
      "at": [
        416,
        130
      ],
      "components": [
        {
          "type": "sprite",
          "size": [
            118,
            16
          ],
          "color": "#5b7186",
          "z": -1
        }
      ]
    },
    {
      "id": "stall_sw",
      "at": [
        120,
        330
      ],
      "components": [
        {
          "type": "sprite",
          "size": [
            90,
            58
          ],
          "color": "#b58f5c",
          "z": 0
        },
        {
          "type": "solid",
          "size": [
            90,
            58
          ]
        }
      ]
    },
    {
      "id": "stall_se",
      "at": [
        430,
        340
      ],
      "components": [
        {
          "type": "sprite",
          "size": [
            100,
            56
          ],
          "color": "#b58f5c",
          "z": 0
        },
        {
          "type": "solid",
          "size": [
            100,
            56
          ]
        }
      ]
    },
    {
      "id": "awning_sw",
      "at": [
        116,
        314
      ],
      "components": [
        {
          "type": "sprite",
          "size": [
            98,
            16
          ],
          "color": "#5b7186",
          "z": -1
        }
      ]
    },
    {
      "id": "talisman_1",
      "at": [
        300,
        108
      ],
      "components": [
        {
          "type": "sprite",
          "size": [
            16,
            16
          ],
          "color": "#c9a24a",
          "z": 1
        },
        {
          "type": "pickup",
          "size": [
            20,
            20
          ],
          "offset": [
            -2,
            -2
          ],
          "item": "bridge_market:talisman_paper",
          "count": 1,
          "once": true
        }
      ]
    },
    {
      "id": "tea_1",
      "at": [
        330,
        384
      ],
      "components": [
        {
          "type": "sprite",
          "size": [
            16,
            16
          ],
          "color": "#6f9b5e",
          "z": 1
        },
        {
          "type": "pickup",
          "size": [
            20,
            20
          ],
          "offset": [
            -2,
            -2
          ],
          "item": "bridge_market:spirit_tea",
          "count": 1,
          "once": true
        }
      ]
    },
    {
      "id": "road_east",
      "at": [
        568,
        90
      ],
      "components": [
        {
          "type": "sprite",
          "size": [
            56,
            64
          ],
          "color": "#8a76a6",
          "z": 1
        },
        {
          "type": "portal",
          "size": [
            56,
            64
          ],
          "target_world": "yuelu_village",
          "target_spawn": "from_market"
        }
      ]
    },
    {
      "id": "road_west",
      "at": [
        16,
        90
      ],
      "components": [
        {
          "type": "sprite",
          "size": [
            48,
            64
          ],
          "color": "#8a76a6",
          "z": 1
        },
        {
          "type": "portal",
          "size": [
            48,
            64
          ],
          "target_world": "pastoral_village",
          "target_spawn": "default"
        }
      ]
    }
  ]
}
