{
  "protocol_version": "0.1.0",
  "id": "pastoral_village",
  "display_name": {
    "zh-CN": "田园村庄",
    "en": "Pastoral Village",
    "ru": "Пасторальная деревня",
    "ja": "田園の村"
  },
  "description": {
    "en": "A quiet village. Somewhere to come back to.",
    "zh-CN": "一座安静的村庄。一个可以回来的地方。"
  },
  "license": {
    "code": "0BSD",
    "assets": "CC0-1.0"
  },
  "bounds": {
    "width": 640,
    "height": 480
  },
  "background": "#c6c29a",
  "spawns": {
    "default": {
      "at": [
        312,
        232
      ]
    },
    "from_xianxia": {
      "at": [
        508,
        228
      ]
    }
  },
  "entities": [
    {
      "id": "wall_n",
      "at": [
        0,
        0
      ],
      "components": [
        {
          "type": "sprite",
          "size": [
            640,
            16
          ],
          "color": "#8a7352",
          "z": -10
        },
        {
          "type": "solid",
          "size": [
            640,
            16
          ]
        }
      ]
    },
    {
      "id": "wall_s",
      "at": [
        0,
        464
      ],
      "components": [
        {
          "type": "sprite",
          "size": [
            640,
            16
          ],
          "color": "#8a7352",
          "z": -10
        },
        {
          "type": "solid",
          "size": [
            640,
            16
          ]
        }
      ]
    },
    {
      "id": "wall_w",
      "at": [
        0,
        0
      ],
      "components": [
        {
          "type": "sprite",
          "size": [
            16,
            480
          ],
          "color": "#8a7352",
          "z": -10
        },
        {
          "type": "solid",
          "size": [
            16,
            480
          ]
        }
      ]
    },
    {
      "id": "wall_e",
      "at": [
        624,
        0
      ],
      "components": [
        {
          "type": "sprite",
          "size": [
            16,
            480
          ],
          "color": "#8a7352",
          "z": -10
        },
        {
          "type": "solid",
          "size": [
            16,
            480
          ]
        }
      ]
    },
    {
      "id": "house_west",
      "at": [
        80,
        80
      ],
      "components": [
        {
          "type": "sprite",
          "size": [
            96,
            80
          ],
          "color": "#a87f52"
        },
        {
          "type": "solid",
          "size": [
            96,
            80
          ]
        }
      ]
    },
    {
      "id": "house_east",
      "at": [
        420,
        96
      ],
      "components": [
        {
          "type": "sprite",
          "size": [
            110,
            88
          ],
          "color": "#a87f52"
        },
        {
          "type": "solid",
          "size": [
            110,
            88
          ]
        }
      ]
    },
    {
      "id": "pond",
      "at": [
        200,
        330
      ],
      "components": [
        {
          "type": "sprite",
          "size": [
            140,
            90
          ],
          "color": "#7d9bad"
        },
        {
          "type": "solid",
          "size": [
            140,
            90
          ]
        }
      ]
    },
    {
      "id": "carrot_1",
      "at": [
        120,
        300
      ],
      "components": [
        {
          "type": "sprite",
          "size": [
            16,
            16
          ],
          "color": "#c9853f",
          "z": 1
        },
        {
          "type": "pickup",
          "size": [
            20,
            20
          ],
          "offset": [
            -2,
            -2
          ],
          "item": "pastoral_village:carrot",
          "count": 1,
          "once": true
        }
      ]
    },
    {
      "id": "gate_to_xianxia",
      "at": [
        560,
        216
      ],
      "components": [
        {
          "type": "sprite",
          "size": [
            48,
            48
          ],
          "color": "#8a76a6",
          "z": 1
        },
        {
          "type": "portal",
          "size": [
            48,
            48
          ],
          "target_world": "xianxia_gate",
          "target_spawn": "from_village"
        }
      ]
    }
  ],
  "props": {}
}
