{
  "protocol_version": "0.1.0",
  "id": "cloud_stair",
  "display_name": {
    "zh-CN": "登云道",
    "en": "The Cloud Stair",
    "ru": "Облачная лестница",
    "ja": "登雲の道"
  },
  "description": {
    "zh-CN": "七百级石阶。雾里看不见上头，也看不见下头。",
    "en": "Seven hundred stone steps. The mist hides the top, and the bottom."
  },
  "license": {
    "code": "0BSD",
    "assets": "CC0-1.0"
  },
  "bounds": {
    "width": 640,
    "height": 480
  },
  "background": "#535e69",
  "spawns": {
    "default": {
      "at": [
        300,
        240
      ]
    },
    "from_village": {
      "at": [
        280,
        370
      ]
    },
    "from_gate": {
      "at": [
        280,
        100
      ]
    }
  },
  "entities": [
    {
      "id": "wall_n",
      "at": [
        0,
        0
      ],
      "components": [
        {
          "type": "sprite",
          "size": [
            640,
            16
          ],
          "color": "#3c4650",
          "z": -10
        },
        {
          "type": "solid",
          "size": [
            640,
            16
          ]
        }
      ]
    },
    {
      "id": "wall_s",
      "at": [
        0,
        464
      ],
      "components": [
        {
          "type": "sprite",
          "size": [
            640,
            16
          ],
          "color": "#3c4650",
          "z": -10
        },
        {
          "type": "solid",
          "size": [
            640,
            16
          ]
        }
      ]
    },
    {
      "id": "wall_w",
      "at": [
        0,
        0
      ],
      "components": [
        {
          "type": "sprite",
          "size": [
            16,
            480
          ],
          "color": "#3c4650",
          "z": -10
        },
        {
          "type": "solid",
          "size": [
            16,
            480
          ]
        }
      ]
    },
    {
      "id": "wall_e",
      "at": [
        624,
        0
      ],
      "components": [
        {
          "type": "sprite",
          "size": [
            16,
            480
          ],
          "color": "#3c4650",
          "z": -10
        },
        {
          "type": "solid",
          "size": [
            16,
            480
          ]
        }
      ]
    },
    {
      "id": "cliff_west",
      "at": [
        16,
        16
      ],
      "components": [
        {
          "type": "sprite",
          "size": [
            150,
            448
          ],
          "color": "#3c4650",
          "z": 0
        },
        {
          "type": "solid",
          "size": [
            150,
            448
          ]
        }
      ]
    },
    {
      "id": "cliff_east",
      "at": [
        474,
        16
      ],
      "components": [
        {
          "type": "sprite",
          "size": [
            150,
            448
          ],
          "color": "#3c4650",
          "z": 0
        },
        {
          "type": "solid",
          "size": [
            150,
            448
          ]
        }
      ]
    },
    {
      "id": "step_0",
      "at": [
        260,
        400
      ],
      "components": [
        {
          "type": "sprite",
          "size": [
            120,
            26
          ],
          "color": "#7c8894",
          "z": -4
        }
      ]
    },
    {
      "id": "step_1",
      "at": [
        260,
        350
      ],
      "components": [
        {
          "type": "sprite",
          "size": [
            120,
            26
          ],
          "color": "#7c8894",
          "z": -4
        }
      ]
    },
    {
      "id": "step_2",
      "at": [
        260,
        300
      ],
      "components": [
        {
          "type": "sprite",
          "size": [
            120,
            26
          ],
          "color": "#7c8894",
          "z": -4
        }
      ]
    },
    {
      "id": "step_3",
      "at": [
        260,
        250
      ],
      "components": [
        {
          "type": "sprite",
          "size": [
            120,
            26
          ],
          "color": "#7c8894",
          "z": -4
        }
      ]
    },
    {
      "id": "step_4",
      "at": [
        260,
        200
      ],
      "components": [
        {
          "type": "sprite",
          "size": [
            120,
            26
          ],
          "color": "#7c8894",
          "z": -4
        }
      ]
    },
    {
      "id": "step_5",
      "at": [
        260,
        150
      ],
      "components": [
        {
          "type": "sprite",
          "size": [
            120,
            26
          ],
          "color": "#7c8894",
          "z": -4
        }
      ]
    },
    {
      "id": "step_6",
      "at": [
        260,
        100
      ],
      "components": [
        {
          "type": "sprite",
          "size": [
            120,
            26
          ],
          "color": "#7c8894",
          "z": -4
        }
      ]
    },
    {
      "id": "pine",
      "at": [
        190,
        120
      ],
      "components": [
        {
          "type": "sprite",
          "size": [
            40,
            56
          ],
          "color": "#2d4536",
          "z": 0
        },
        {
          "type": "solid",
          "size": [
            40,
            56
          ]
        }
      ]
    },
    {
      "id": "pine_2",
      "at": [
        420,
        290
      ],
      "components": [
        {
          "type": "sprite",
          "size": [
            36,
            50
          ],
          "color": "#2d4536",
          "z": 0
        },
        {
          "type": "solid",
          "size": [
            36,
            50
          ]
        }
      ]
    },
    {
      "id": "lingzhi_1",
      "at": [
        400,
        330
      ],
      "components": [
        {
          "type": "sprite",
          "size": [
            16,
            16
          ],
          "color": "#b4703c",
          "z": 1
        },
        {
          "type": "pickup",
          "size": [
            20,
            20
          ],
          "offset": [
            -2,
            -2
          ],
          "item": "cloud_stair:wild_lingzhi",
          "count": 1,
          "once": true
        }
      ]
    },
    {
      "id": "down_to_village",
      "at": [
        250,
        410
      ],
      "components": [
        {
          "type": "sprite",
          "size": [
            80,
            54
          ],
          "color": "#9b7fe0",
          "z": 1
        },
        {
          "type": "portal",
          "size": [
            80,
            54
          ],
          "target_world": "yuelu_village",
          "target_spawn": "from_stair"
        }
      ]
    },
    {
      "id": "up_to_gate",
      "at": [
        250,
        22
      ],
      "components": [
        {
          "type": "sprite",
          "size": [
            80,
            54
          ],
          "color": "#9b7fe0",
          "z": 1
        },
        {
          "type": "portal",
          "size": [
            80,
            54
          ],
          "target_world": "qifeng_gate",
          "target_spawn": "from_stair"
        }
      ]
    }
  ]
}
