{
  "protocol_version": "0.1.0",
  "id": "qifeng_gate",
  "display_name": {
    "zh-CN": "岐峰门",
    "en": "Forked Peak Sect",
    "ru": "Врата Раздвоенной Вершины",
    "ja": "岐峰門"
  },
  "description": {
    "zh-CN": "一个小门派的山门。收杂役，不问出身。",
    "en": "The gate of a minor sect. It takes menial hands, and does not ask where they came from."
  },
  "license": {
    "code": "0BSD",
    "assets": "CC0-1.0"
  },
  "bounds": {
    "width": 640,
    "height": 480
  },
  "background": "#1d2a2a",
  "spawns": {
    "default": {
      "at": [
        300,
        230
      ]
    },
    "from_stair": {
      "at": [
        280,
        370
      ]
    },
    "from_field": {
      "at": [
        280,
        100
      ]
    }
  },
  "entities": [
    {
      "id": "wall_n",
      "at": [
        0,
        0
      ],
      "components": [
        {
          "type": "sprite",
          "size": [
            640,
            16
          ],
          "color": "#2a3636",
          "z": -10
        },
        {
          "type": "solid",
          "size": [
            640,
            16
          ]
        }
      ]
    },
    {
      "id": "wall_s",
      "at": [
        0,
        464
      ],
      "components": [
        {
          "type": "sprite",
          "size": [
            640,
            16
          ],
          "color": "#2a3636",
          "z": -10
        },
        {
          "type": "solid",
          "size": [
            640,
            16
          ]
        }
      ]
    },
    {
      "id": "wall_w",
      "at": [
        0,
        0
      ],
      "components": [
        {
          "type": "sprite",
          "size": [
            16,
            480
          ],
          "color": "#2a3636",
          "z": -10
        },
        {
          "type": "solid",
          "size": [
            16,
            480
          ]
        }
      ]
    },
    {
      "id": "wall_e",
      "at": [
        624,
        0
      ],
      "components": [
        {
          "type": "sprite",
          "size": [
            16,
            480
          ],
          "color": "#2a3636",
          "z": -10
        },
        {
          "type": "solid",
          "size": [
            16,
            480
          ]
        }
      ]
    },
    {
      "id": "pillar_west",
      "at": [
        240,
        120
      ],
      "components": [
        {
          "type": "sprite",
          "size": [
            36,
            180
          ],
          "z": 0,
          "color": "#8a8f98"
        },
        {
          "type": "solid",
          "size": [
            36,
            180
          ]
        }
      ]
    },
    {
      "id": "pillar_east",
      "at": [
        364,
        120
      ],
      "components": [
        {
          "type": "sprite",
          "size": [
            36,
            180
          ],
          "color": "#8a8f98",
          "z": 0
        },
        {
          "type": "solid",
          "size": [
            36,
            180
          ]
        }
      ]
    },
    {
      "id": "lintel",
      "at": [
        240,
        96
      ],
      "components": [
        {
          "type": "sprite",
          "size": [
            160,
            26
          ],
          "color": "#6d737c",
          "z": -2
        }
      ]
    },
    {
      "id": "plaque",
      "at": [
        286,
        66
      ],
      "components": [
        {
          "type": "sprite",
          "size": [
            68,
            24
          ],
          "color": "#5fa08a",
          "z": -1
        }
      ]
    },
    {
      "id": "bell",
      "at": [
        492,
        150
      ],
      "components": [
        {
          "type": "sprite",
          "size": [
            28,
            38
          ],
          "color": "#8a6a3a",
          "z": 0
        },
        {
          "type": "solid",
          "size": [
            28,
            38
          ]
        }
      ]
    },
    {
      "id": "bell_post",
      "at": [
        486,
        188
      ],
      "components": [
        {
          "type": "sprite",
          "size": [
            40,
            12
          ],
          "color": "#4a4038",
          "z": 0
        },
        {
          "type": "solid",
          "size": [
            40,
            12
          ]
        }
      ]
    },
    {
      "id": "stone_lion_w",
      "at": [
        150,
        230
      ],
      "components": [
        {
          "type": "sprite",
          "size": [
            30,
            34
          ],
          "color": "#6d737c",
          "z": 0
        },
        {
          "type": "solid",
          "size": [
            30,
            34
          ]
        }
      ]
    },
    {
      "id": "stone_lion_e",
      "at": [
        460,
        230
      ],
      "components": [
        {
          "type": "sprite",
          "size": [
            30,
            34
          ],
          "color": "#6d737c",
          "z": 0
        },
        {
          "type": "solid",
          "size": [
            30,
            34
          ]
        }
      ]
    },
    {
      "id": "spirit_stone_1",
      "at": [
        140,
        330
      ],
      "components": [
        {
          "type": "sprite",
          "size": [
            16,
            16
          ],
          "color": "#8fd8c8",
          "z": 1
        },
        {
          "type": "pickup",
          "size": [
            20,
            20
          ],
          "offset": [
            -2,
            -2
          ],
          "item": "qifeng_gate:low_spirit_stone",
          "count": 1,
          "once": true
        }
      ]
    },
    {
      "id": "qi_pill_1",
      "at": [
        500,
        330
      ],
      "components": [
        {
          "type": "sprite",
          "size": [
            16,
            16
          ],
          "color": "#d8a04a",
          "z": 1
        },
        {
          "type": "pickup",
          "size": [
            20,
            20
          ],
          "offset": [
            -2,
            -2
          ],
          "item": "qifeng_gate:qi_gathering_pill",
          "count": 1,
          "once": true
        }
      ]
    },
    {
      "id": "down_to_stair",
      "at": [
        280,
        410
      ],
      "components": [
        {
          "type": "sprite",
          "size": [
            80,
            54
          ],
          "color": "#9b7fe0",
          "z": 1
        },
        {
          "type": "portal",
          "size": [
            80,
            54
          ],
          "target_world": "cloud_stair",
          "target_spawn": "from_gate"
        }
      ]
    },
    {
      "id": "in_to_field",
      "at": [
        280,
        22
      ],
      "components": [
        {
          "type": "sprite",
          "size": [
            80,
            54
          ],
          "color": "#9b7fe0",
          "z": 1
        },
        {
          "type": "portal",
          "size": [
            80,
            54
          ],
          "target_world": "spirit_field",
          "target_spawn": "from_gate"
        }
      ]
    }
  ]
}
